<?xml version="1.0" encoding="UTF-8" ?>
<gulp
    xmlns:xsi="http://www.w3.org/2001/XMLSchema-instance"
    xsi:noNamespaceSchemaLocation="urn:magento:module:MaxBucknell_Gulp:etc/gulp.xsd"
>
    <task name="env">
        <command>env</command>
    </task>

    <task name="flatten">
        <dependencies>
            <package name="lodash" version="latest" />
            <package name="glob" version="latest" />
            <package name="mkdirp" version="latest" />
        </dependencies>

        <command>node MaxBucknell_Gulp/task/flatten.js</command>
    </task>
</gulp>